{"schema":"nrm.customer.resource_demand_request.v1","messageId":"demand-001","timestamp":"2026-08-17T10:00:00+08:00","source":"CUSTOMER","data":{"demandSetId":"mission-demands","revision":1,"demands":[{"demandId":"video-01","sourcePlatformId":"survey_uav_1","destinationPlatformId":"data_processing_center","businessType":"ISR_VIDEO","requiredBandwidthBps":5000000,"maximumDelayMs":2000,"minimumPdrPercent":95,"allowedNetworks":["CDL","SATCOM"],"missionStage":"SURVEILLANCE","businessTrafficBps":4500000,"maximumDistanceM":300000,"minimumNetworkSize":2},{"demandId":"command-01","sourcePlatformId":"network_control_center","destinationPlatformId":"mission_aircraft_1","businessType":"C2","requiredBandwidthBps":64000,"maximumDelayMs":300,"minimumPdrPercent":99,"allowedNetworks":["LINK16","SATCOM"]}]}}
